{
  "spec_version": 1,
  "series": "abc-language",
  "slug": "it-alphabet",
  "title": "The IT Alphabet",
  "subtitle": "A is for Automation",
  "theme": "IT systems",
  "audience": "toddler",
  "language": "en",
  "art_style": "isometric-tech-toy",
  "palette": "cool-tech",
  "background": "plain",
  "mood": "playful",
  "lettering": "rounded",
  "art_style_prompt": "cute isometric toy-technology illustration for a toddler picture book, chunky rounded 3D shapes like soft plastic building blocks, friendly pastel technology palette, gentle studio lighting, soft shadows, smooth matte surfaces, simple and uncluttered",
  "generator": "Text generated by the zer0-CMS ABC wizard from the bundled IT systems lexicon; illustrations composed for the zer0-image-generator plugin and rendered by drsai.",
  "cover": {
    "subject": "a joyful cover for an alphabet book about IT systems, a big friendly letter A and a smiling Automation",
    "prompt": "cute isometric toy-technology illustration for a toddler picture book, chunky rounded 3D shapes like soft plastic building blocks, friendly pastel technology palette, gentle studio lighting, soft shadows, smooth matte surfaces, simple and uncluttered. in a simple uncluttered little scene with lots of empty space. cool palette of sky blue, mint, soft violet and clean white. Subject: a joyful cover for an alphabet book about IT systems, a big friendly letter A and a smiling Automation, standing for the word AUTOMATION (letter A). playful, cheerful and full of wonder. Toddler picture-book board-book art, bright and simple, big friendly subject centered with generous margins, thick clean outlines, absolutely no text, words, letters or numbers anywhere in the image, wholesome and never scary.",
    "image": "/assets/images/books/it-alphabet/cover.png",
    "alt": "Cover of The IT Alphabet."
  },
  "alphabet": [
    {
      "letter": "A",
      "word": "Automation",
      "subject": "a friendly robot arm stacking soft toy blocks all by itself",
      "tagline": "A is for Automation — little helpers that do the work for us!",
      "alt": "A cheerful robot arm stacking blocks on its own.",
      "prompt": "cute isometric toy-technology illustration for a toddler picture book, chunky rounded 3D shapes like soft plastic building blocks, friendly pastel technology palette, gentle studio lighting, soft shadows, smooth matte surfaces, simple and uncluttered. on a plain softly-vignetted single-colour background. cool palette of sky blue, mint, soft violet and clean white. Subject: a friendly robot arm stacking soft toy blocks all by itself, standing for the word AUTOMATION (letter A). playful, cheerful and full of wonder. Toddler picture-book board-book art, bright and simple, big friendly subject centered with generous margins, thick clean outlines, absolutely no text, words, letters or numbers anywhere in the image, wholesome and never scary.",
      "image": "/assets/images/books/it-alphabet/a-automation.png",
      "status": "planned"
    },
    {
      "letter": "B",
      "word": "Backup",
      "subject": "two identical happy folders holding hands, one labelled with a heart",
      "tagline": "B is for Backup — keep a spare copy so nothing gets lost!",
      "alt": "Two matching folders side by side, keeping each other safe.",
      "prompt": "cute isometric toy-technology illustration for a toddler picture book, chunky rounded 3D shapes like soft plastic building blocks, friendly pastel technology palette, gentle studio lighting, soft shadows, smooth matte surfaces, simple and uncluttered. on a plain softly-vignetted single-colour background. cool palette of sky blue, mint, soft violet and clean white. Subject: two identical happy folders holding hands, one labelled with a heart, standing for the word BACKUP (letter B). playful, cheerful and full of wonder. Toddler picture-book board-book art, bright and simple, big friendly subject centered with generous margins, thick clean outlines, absolutely no text, words, letters or numbers anywhere in the image, wholesome and never scary.",
      "image": "/assets/images/books/it-alphabet/b-backup.png",
      "status": "planned"
    },
    {
      "letter": "C",
      "word": "Cloud",
      "subject": "a smiling fluffy cloud with tiny data raindrops falling gently",
      "tagline": "C is for Cloud — computers that live up in the sky!",
      "alt": "A smiling cloud sprinkling little sparkles of data.",
      "prompt": "cute isometric toy-technology illustration for a toddler picture book, chunky rounded 3D shapes like soft plastic building blocks, friendly pastel technology palette, gentle studio lighting, soft shadows, smooth matte surfaces, simple and uncluttered. on a plain softly-vignetted single-colour background. cool palette of sky blue, mint, soft violet and clean white. Subject: a smiling fluffy cloud with tiny data raindrops falling gently, standing for the word CLOUD (letter C). playful, cheerful and full of wonder. Toddler picture-book board-book art, bright and simple, big friendly subject centered with generous margins, thick clean outlines, absolutely no text, words, letters or numbers anywhere in the image, wholesome and never scary.",
      "image": "/assets/images/books/it-alphabet/c-cloud.png",
      "status": "planned"
    },
    {
      "letter": "D",
      "word": "Database",
      "subject": "a neat stack of labelled drawers, each full of tidy shapes",
      "tagline": "D is for Database — a big tidy box that remembers everything!",
      "alt": "A stack of tidy drawers, each holding neatly sorted shapes.",
      "prompt": "cute isometric toy-technology illustration for a toddler picture book, chunky rounded 3D shapes like soft plastic building blocks, friendly pastel technology palette, gentle studio lighting, soft shadows, smooth matte surfaces, simple and uncluttered. on a plain softly-vignetted single-colour background. cool palette of sky blue, mint, soft violet and clean white. Subject: a neat stack of labelled drawers, each full of tidy shapes, standing for the word DATABASE (letter D). playful, cheerful and full of wonder. Toddler picture-book board-book art, bright and simple, big friendly subject centered with generous margins, thick clean outlines, absolutely no text, words, letters or numbers anywhere in the image, wholesome and never scary.",
      "image": "/assets/images/books/it-alphabet/d-database.png",
      "status": "planned"
    },
    {
      "letter": "E",
      "word": "Encryption",
      "subject": "a cheerful padlock hugging a letter, sparkling with secret stars",
      "tagline": "E is for Encryption — secret code that keeps things safe!",
      "alt": "A friendly padlock wrapping a message in sparkles.",
      "prompt": "cute isometric toy-technology illustration for a toddler picture book, chunky rounded 3D shapes like soft plastic building blocks, friendly pastel technology palette, gentle studio lighting, soft shadows, smooth matte surfaces, simple and uncluttered. on a plain softly-vignetted single-colour background. cool palette of sky blue, mint, soft violet and clean white. Subject: a cheerful padlock hugging a letter, sparkling with secret stars, standing for the word ENCRYPTION (letter E). playful, cheerful and full of wonder. Toddler picture-book board-book art, bright and simple, big friendly subject centered with generous margins, thick clean outlines, absolutely no text, words, letters or numbers anywhere in the image, wholesome and never scary.",
      "image": "/assets/images/books/it-alphabet/e-encryption.png",
      "status": "planned"
    },
    {
      "letter": "F",
      "word": "Firewall",
      "subject": "a sturdy brick wall shielding a happy little computer, a shield in front",
      "tagline": "F is for Firewall — a wall that stops the naughty bits!",
      "alt": "A brick wall with a shield, protecting a smiling computer.",
      "prompt": "cute isometric toy-technology illustration for a toddler picture book, chunky rounded 3D shapes like soft plastic building blocks, friendly pastel technology palette, gentle studio lighting, soft shadows, smooth matte surfaces, simple and uncluttered. on a plain softly-vignetted single-colour background. cool palette of sky blue, mint, soft violet and clean white. Subject: a sturdy brick wall shielding a happy little computer, a shield in front, standing for the word FIREWALL (letter F). playful, cheerful and full of wonder. Toddler picture-book board-book art, bright and simple, big friendly subject centered with generous margins, thick clean outlines, absolutely no text, words, letters or numbers anywhere in the image, wholesome and never scary.",
      "image": "/assets/images/books/it-alphabet/f-firewall.png",
      "status": "planned"
    },
    {
      "letter": "G",
      "word": "Gateway",
      "subject": "a friendly archway doorway with a glowing path leading through it",
      "tagline": "G is for Gateway — a doorway between two places!",
      "alt": "A glowing archway doorway inviting you through.",
      "prompt": "cute isometric toy-technology illustration for a toddler picture book, chunky rounded 3D shapes like soft plastic building blocks, friendly pastel technology palette, gentle studio lighting, soft shadows, smooth matte surfaces, simple and uncluttered. on a plain softly-vignetted single-colour background. cool palette of sky blue, mint, soft violet and clean white. Subject: a friendly archway doorway with a glowing path leading through it, standing for the word GATEWAY (letter G). playful, cheerful and full of wonder. Toddler picture-book board-book art, bright and simple, big friendly subject centered with generous margins, thick clean outlines, absolutely no text, words, letters or numbers anywhere in the image, wholesome and never scary.",
      "image": "/assets/images/books/it-alphabet/g-gateway.png",
      "status": "planned"
    },
    {
      "letter": "H",
      "word": "Hardware",